{
  "$schema": "http://json-schema.org/draft-07/schema#",
  "title": "ResearchOutput",
  "type": "object",
  "required": [
    "executive_summary",
    "key_facts",
    "key_fact_sources",
    "data_points",
    "sources",
    "contrarian_angle",
    "viewer_takeaway",
    "schema_version"
  ],
  "properties": {
    "executive_summary": { "type": "string" },
    "key_facts": { "type": "array", "items": { "type": "string" } },
    "key_fact_sources": {
      "type": "array",
      "items": {
        "type": "object",
        "required": ["claim", "source_ids"],
        "properties": {
          "claim": { "type": "string" },
          "source_ids": { "type": "array", "items": { "type": "string" } }
        }
      }
    },
    "data_points": {
      "type": "array",
      "items": {
        "type": "object",
        "required": ["metric", "value", "timeframe", "source_id"],
        "properties": {
          "metric": { "type": "string" },
          "value": { "type": "string" },
          "timeframe": { "type": "string" },
          "source_id": { "type": "string" }
        }
      }
    },
    "sources": {
      "type": "array",
      "items": {
        "type": "object",
        "required": [
          "source_id",
          "title",
          "url",
          "as_of_date",
          "source_tier",
          "freshness_window_days"
        ],
        "properties": {
          "source_id": { "type": "string" },
          "title": { "type": "string" },
          "url": { "type": "string" },
          "as_of_date": { "type": "string" },
          "source_tier": { "type": "string" },
          "freshness_window_days": { "type": "number" }
        }
      }
    },
    "contrarian_angle": { "type": "string" },
    "viewer_takeaway": { "type": "string" },
    "schema_version": { "type": "string" }
  }
}
