{
  "executive_summary": "The YouTube video titled \"The Reason You Get Poorer Holding Cash (Everything about Exchange Rates in 19 Minutes)\" likely addresses how economic factors such as inflation and fluctuating exchange rates erode the purchasing power of cash, making individuals poorer in real terms if they simply hold onto physical currency. It targets those with limited financial literacy, aiming to explain complex economic concepts in an accessible manner. The core message emphasizes that passive cash holdings do not preserve wealth in dynamic economic environments.",
  "key_facts": [
    "Inflation steadily reduces the purchasing power of money over time, meaning that a fixed amount of cash will buy fewer goods and services in the future.",
    "Holding large amounts of cash, especially during periods of high inflation, leads to a depreciation of its real value.",
    "Exchange rate fluctuations directly impact the international purchasing power of a currency, affecting the cost of imported goods and the value of foreign assets.",
    "Understanding fundamental economic principles like inflation and exchange rates is crucial for sound personal financial management and wealth preservation."
  ],
  "key_fact_sources": [
    {
      "claim": "Inflation steadily reduces the purchasing power of money over time, meaning that a fixed amount of cash will buy fewer goods and services in the future.",
      "source_ids": [
        "src-002"
      ]
    },
    {
      "claim": "Holding large amounts of cash, especially during periods of high inflation, leads to a depreciation of its real value.",
      "source_ids": [
        "src-003"
      ]
    },
    {
      "claim": "Exchange rate fluctuations directly impact the international purchasing power of a currency, affecting the cost of imported goods and the value of foreign assets.",
      "source_ids": [
        "src-004"
      ]
    },
    {
      "claim": "Understanding fundamental economic principles like inflation and exchange rates is crucial for sound personal financial management and wealth preservation.",
      "source_ids": [
        "src-001",
        "src-002",
        "src-003",
        "src-004"
      ]
    }
  ],
  "data_points": [
    {
      "metric": "U.S. Annual Inflation Rate (Consumer Price Index)",
      "value": "8.0%",
      "timeframe": "2022",
      "source_id": "src-005"
    }
  ],
  "sources": [
    {
      "source_id": "src-001",
      "title": "금융문맹은 꼭 보세요.. 현금을 들고있으면 가난해지는 이유 (19분만에 알아보는 환율의 모든것)",
      "url": "https://www.youtube.com/watch?v=Y-lFcCk0uEQ",
      "as_of_date": "2023-09-11",
      "source_tier": "tier_3",
      "freshness_window_days": 365
    },
    {
      "source_id": "src-002",
      "title": "Inflation",
      "url": "https://www.investopedia.com/terms/i/inflation.asp",
      "as_of_date": "2024-01-20",
      "source_tier": "tier_1",
      "freshness_window_days": 730
    },
    {
      "source_id": "src-003",
      "title": "Why Holding Cash Can Be a Mistake",
      "url": "https://www.thebalancemoney.com/why-holding-cash-can-be-a-mistake-416043",
      "as_of_date": "2023-12-12",
      "source_tier": "tier_2",
      "freshness_window_days": 365
    },
    {
      "source_id": "src-004",
      "title": "How Exchange Rates Affect Businesses and Individuals",
      "url": "https://www.investopedia.com/articles/forex/11/forex-impact.asp",
      "as_of_date": "2023-04-25",
      "source_tier": "tier_1",
      "freshness_window_days": 730
    },
    {
      "source_id": "src-005",
      "title": "Consumer Price Index",
      "url": "https://www.bls.gov/cpi/",
      "as_of_date": "2024-01-11",
      "source_tier": "tier_1",
      "freshness_window_days": 90
    },
    {
      "source_id": "src-006",
      "title": "How much cash should you keep on hand?",
      "url": "https://www.bankrate.com/banking/how-much-cash-should-you-keep-on-hand/",
      "as_of_date": "2023-11-20",
      "source_tier": "tier_2",
      "freshness_window_days": 365
    }
  ],
  "contrarian_angle": "While holding excessive cash during inflationary periods can lead to a loss of purchasing power, maintaining a strategic amount of cash is crucial for financial health. Cash provides immediate liquidity for emergencies, allows for flexibility to seize investment opportunities during market downturns, and serves as a low-risk asset during periods of high market volatility. An appropriate emergency fund, typically covering 3-6 months of living expenses, is a widely recommended financial practice.",
  "viewer_takeaway": "1. **Financial Education is Key:** Actively seek to understand basic economic concepts like inflation and exchange rates to make informed financial decisions.\n2. **Avoid Excessive Cash Holdings:** Be mindful that simply holding large sums of cash, especially during inflationary periods, will likely result in a decrease in its real value over time.\n3. **Diversify Assets:** Consider investing and diversifying your assets to protect against inflation and currency depreciation, rather than relying solely on cash.\n4. **Maintain an Emergency Fund:** Keep a sensible amount of cash or highly liquid assets readily available for unexpected expenses, balancing the need for liquidity with the risk of inflation.",
  "schema_version": "1.0"
}